{
 "schemaVersion": 1,
 "kind": "skill-family.documentation-capability-catalog",
 "bundle": "locale-overlay",
 "locale": "zh-CN",
 "generatedFrom": [
  "package.json",
  "packages/skill-family-contracts/package.json",
  "packages/skill-family-harness-node/package.json",
  "packages/skill-family-engineering-kit/package.json",
  "packages/skill-family-contracts/src/index.mjs",
  "packages/skill-family-harness-node/src/index.mjs",
  "packages/skill-family-engineering-kit/src/index.mjs",
  "packages/skill-family-engineering-kit/src/cli.mjs",
  "packages/skill-family-contracts/src/registry.json",
  "profiles/README.md",
  "docs/architecture.md",
  "docs/status/current.md"
 ],
 "capabilities": [
  {
   "id": "foundation.contracts.object-validation",
      "intent": "用 Ajv 8.20.0（精确 pin）在 draft-07 与 2020-12 双方言下编译并校验当前本地 Foundation 合同源码已登记的 53 类顶层对象文档",
   "useWhen": [
        "需要校验 project-manifest、professional-conclusion、profile-descriptor、report-model 等已登记契约对象",
    "需要探测文档方言并选择 strict 或 tolerant 校验策略"
   ],
   "doNotUseWhen": [
    "需要校验消费者自有业务 Schema（消费者应自行持有，Foundation 不取代）",
    "需要把领域语义校验混入通用契约"
   ],
   "prerequisites": [
    "待校验文档带有已登记契约对象的 $id",
    "Node >= 22.22.2"
   ],
   "inputs": [
    "契约文档对象（任意 JSON 值）",
    "目标契约对象 $id 或 schema",
    "校验策略（strict | tolerant，默认 strict）"
   ],
   "outputs": [
    "校验通过：返回 {valid:true}（不含 errorCode 字段）",
    "校验失败：返回 {valid:false, errorCode, errors}，不抛出",
    "首次编译结果写入 Ajv 编译缓存，后续同 (schemaId,dialect,policy) 复用"
   ],
   "sideEffects": [
    "无文件系统、Git、网络或进程副作用（纯函数 + 内存缓存）"
   ],
   "failureSemantics": [
    "SFC1002：未知契约对象 $id 未登记（返回 valid:false，不抛出）",
    "SFC1001：文档不符合已登记 Schema（返回 valid:false，errors 含 Ajv keyword 明细）",
    "调用方以返回值的 valid 字段判断成败，不以 try/catch 捕获——validateDocument 永不抛出",
    "compileSchema 对无法编译的 schema 抛 ContractsError（SFC1012 SCHEMA_COMPILE_FAILED）；detectDialect 对未知方言抛 ContractsError（SFC1006）"
   ],
   "invariants": [
    "同一 (对象, 方言, 策略) 复用编译缓存，重复校验不重新编译",
    "仅接受 Ajv 8.20.0，不接入其他校验器"
   ],
   "ownedByCaller": [
    "具体业务字段的语义解释",
    "领域级校验规则"
   ],
   "routeElsewhere": [
    "消费者业务 Schema 校验：留在调用方",
    "远端发布写入：转 release-skill"
   ]
  },
  {
   "id": "foundation.contracts.registry-protocol",
   "intent": "登记并查询契约对象 Schema $id 与协议名，作为协议名与 Schema 唯一权威",
   "useWhen": [
    "需要按对象名或 $id 查找已登记 Schema",
    "需要按协议名查找 kernel 协议定义"
   ],
   "doNotUseWhen": [
    "需要在没有 ADR 的情况下新增顶层登记对象（42 类对象集已经固定）",
    "需要让调用方自带 Registry、Schema 或协议名覆盖随包登记表"
   ],
   "prerequisites": [
    "registry.json 已随包发布",
    "Node >= 22.22.2"
   ],
   "inputs": [
    "对象名、Schema $id 或协议名"
   ],
   "outputs": [
    "已登记的 Schema 元信息或协议定义",
    "查询未命中时返回 undefined 或抛错"
   ],
   "sideEffects": [
    "无文件系统、Git、网络或进程副作用（纯函数）"
   ],
   "failureSemantics": [
    "SFC1003：重复 $id 登记",
    "SFC1004：重复协议登记"
   ],
   "invariants": [
    "registry.json 的 schemaVersion=1、contractsVersion 为唯一权威",
    "42 类顶层对象集合固定，新增需 ADR"
   ],
   "ownedByCaller": [
    "对象业务含义的解释",
    "新增登记对象的 ADR、版本与迁移决策"
   ],
   "routeElsewhere": [
    "发布状态：转 release-skill"
   ]
  },
  {
   "id": "foundation.contracts.kernel-protocol",
   "intent": "加载并校验 skill-family.kernel.operation 协议（stable，Kernel 文档生命周期坐标 1.8.0），定义操作请求/结果结构",
   "useWhen": [
    "需要解析或校验 operation-request / operation-result 结构",
    "需要按操作名查找参数契约"
   ],
   "doNotUseWhen": [
    "需要定义业务操作语义（语义由消费者拥有）"
   ],
   "prerequisites": [
    "kernel-protocol.json 已随包发布"
   ],
   "inputs": [
    "协议名、操作名、操作参数"
   ],
   "outputs": [
    "协议定义或操作参数校验结果"
   ],
   "sideEffects": [
    "无副作用（纯函数）"
   ],
   "failureSemantics": [
    "SFC2002：未知操作",
    "SFC2003：参数违反协议"
   ],
   "invariants": [
    "kernel 协议版本与 Contracts 版本绑定"
   ],
   "ownedByCaller": [
    "操作的具体业务语义"
   ],
   "routeElsewhere": [
    "业务状态机/重试/终态：转 loop-agent"
   ]
  },
  {
   "id": "foundation.contracts.mandatory-checks",
   "intent": "运行 9 类 mandatory rule 的机械检查（预算上限 20，绝对上限 30），对登记表内全部 Schema 统一编译",
   "useWhen": [
    "需要确认契约集满足强制机械规则",
    "需要收集未解析引用（unresolved refs）"
   ],
   "doNotUseWhen": [
    "需要语义级审阅（属外部独立审阅，不在仓内维护第二份门禁）"
   ],
   "prerequisites": [
    "registry 与 rules 已加载"
   ],
   "inputs": [
    "待检查的契约集或合成 registry/fixtures"
   ],
   "outputs": [
    "检查结论与未解析引用清单"
   ],
   "sideEffects": [
    "无副作用（纯函数）"
   ],
   "failureSemantics": [
    "SFC1002/1003/1004/1005/1006/1008/1009/1010：对应规则 violated"
   ],
   "invariants": [
    "CHECK_TYPES 为 9 类闭集",
    "RULE_BUDGET 限制 firstVersionMax 与 absoluteMax"
   ],
   "ownedByCaller": [
    "规则业务理由的解释"
   ],
   "routeElsewhere": [
    "语义接受/拒绝：外部独立审阅"
   ]
  },
  {
   "id": "foundation.contracts.fixture-verification",
   "intent": "枚举并校验公开/虚构 fixture，确认其符合对应契约对象的 expect 声明",
   "useWhen": [
    "需要证明某契约对象被 fixture 覆盖",
    "需要运行 positive/negative/dialect-boundary 类 fixture"
   ],
   "doNotUseWhen": [
    "需要把 fixture 当作业务 oracle（fixture 只证明结构，不证明语义）",
    "需要用复制 fixture 或本地 runner 替代真实消费者资格"
   ],
   "prerequisites": [
    "fixtures 目录为公开或完全虚构数据"
   ],
   "inputs": [
    "fixture 类或单个 fixture 标识"
   ],
   "outputs": [
    "逐 fixture 的校验结果"
   ],
   "sideEffects": [
    "无副作用（只读 fixture）"
   ],
   "failureSemantics": [
    "SFC1010：负例 fixture 未产生预期失败"
   ],
   "invariants": [
    "fixture 与审计器预期结果不共享"
   ],
   "ownedByCaller": [
    "fixture 背后的业务意图"
   ],
   "routeElsewhere": [
    "领域审计语义：转独立审计消费者"
   ]
  },
  {
   "id": "foundation.contracts.error-codes",
   "intent": "定义并登记稳定错误码体系，提供校验与断言入口，保证错误码不漂移",
   "useWhen": [
    "需要抛出或分类带稳定错误码的 ContractsError",
    "需要断言某错误码已登记"
   ],
   "doNotUseWhen": [
    "需要定义在 Foundation 范围外的业务错误语义"
   ],
   "prerequisites": [
    "error-codes.json 已随包发布"
   ],
   "inputs": [
    "错误码字符串、错误上下文"
   ],
   "outputs": [
    "带稳定错误码与 details 的错误对象"
   ],
   "sideEffects": [
    "无副作用（纯函数）"
   ],
   "failureSemantics": [
    "对未登记错误码的断言失败",
    "冻结对象不可变违反"
   ],
   "invariants": [
    "错误码注册表冻结，不可运行时增删"
   ],
   "ownedByCaller": [
    "错误码的业务归因"
   ],
   "routeElsewhere": [
    "语义审阅结论：外部独立审阅"
   ]
  },
  {
   "id": "foundation.contracts.audit-surface",
   "intent": "以确定性方式序列化契约表面（canonical JSON + sha256 摘要），供审计消费者只读投影",
   "useWhen": [
    "需要为契约表面生成可复算摘要",
    "需要描述审计表面结构"
   ],
   "doNotUseWhen": [
    "需要审计领域语义（语义与最终接受/拒绝属外部审阅）"
   ],
   "prerequisites": [
    "AUDIT_SURFACE_VERSION=1、AUDIT_DIGEST_ALGORITHMS=[sha256]"
   ],
   "inputs": [
    "任意 JSON 文档"
   ],
   "outputs": [
    "canonical 字符串与 sha256 摘要"
   ],
   "sideEffects": [
    "无副作用（纯函数）"
   ],
   "failureSemantics": [
    "非 JSON 值、未知算法、冻结违规均抛错"
   ],
   "invariants": [
    "摘要算法仅 sha256，版本号固定"
   ],
   "ownedByCaller": [
    "审计语义结论"
   ],
   "routeElsewhere": [
    "领域审计语义：转独立审计消费者"
   ]
  },
  {
   "id": "foundation.contracts.token-estimate-consumption",
   "intent": "定义 token 估算记录的最小消费合同：哪个字段承载数值估算、退化的裸整数形态与失败关闭的拒绝语义",
   "useWhen": [
    "需要从 token-estimate-record 提取数值估算并校验降级形态",
    "需要拒绝估算器不可混用或目标字段缺失的记录"
   ],
   "doNotUseWhen": [
    "需要生成估算记录（归 harness estimateTokens）",
    "需要解释估算结果的业务含义"
   ],
   "prerequisites": [],
   "inputs": [
    "token-estimate-record 文档或其退化裸整数形态"
   ],
   "outputs": [
    "消费结果（数值估算与来源标识）或失败关闭拒绝"
   ],
   "sideEffects": [
    "纯函数，无文件系统、Git、网络或进程副作用"
   ],
   "failureSemantics": [
    "估算器不匹配或字段缺失时以稳定错误种类失败关闭",
    "拒绝结果携带 closed 枚举原因，不静默降级"
   ],
   "invariants": [
    "不同估算器结果不得静默混用",
    "消费合同不新增顶层对象类"
   ],
   "ownedByCaller": [
    "估算的触发时机与结果的业务解释"
   ],
   "routeElsewhere": [
    "估算记录生成：foundation.harness.token-estimation"
   ]
  },
  {
   "id": "foundation.harness.contract-validation",
   "intent": "在 Node 运行时解析契约上下文并复用 Contracts 校验器，校验契约文档并缓存校验器实例",
   "useWhen": [
    "需要在 Node 内校验 Foundation 契约文档",
    "需要复用以 schema 为键的校验器缓存"
   ],
   "doNotUseWhen": [
    "需要在非 Node 运行时校验（当前只有 Node 实现）"
   ],
   "prerequisites": [
    "已安装 skill-family-contracts"
   ],
   "inputs": [
    "schema 上下文、契约文档"
   ],
   "outputs": [
    "校验结果，复用缓存的 Ajv 实例"
   ],
   "sideEffects": [
    "进程内内存缓存校验器（无文件/Git/网络）"
   ],
   "failureSemantics": [
    "date-time 等反例矩阵触发 SFC 校验失败"
   ],
   "invariants": [
    "校验器以 (schema) 为键缓存，size 可查询"
   ],
   "ownedByCaller": [
    "契约业务字段语义",
    "进程内 validator cache 的生命周期与失效时机"
   ],
   "routeElsewhere": [
    "契约对象定义：转 Contracts",
    "需要新增 Schema、Registry 或跨进程缓存：回到 Contracts/架构裁决"
   ]
  },
  {
   "id": "foundation.harness.path-containment",
   "intent": "把外部路径输入分类并解析到受收容根目录内，拒绝路径穿越、symlink 逃逸与 realpath 逃逸",
   "useWhen": [
    "需要把用户/调用方提供的路径限制在某个根目录内",
    "需要安全读取受收容文件",
    "需要在进入具体读取器前统一拒绝绝对路径、穿越段和符号链接逃逸"
   ],
   "doNotUseWhen": [
    "需要把文件选择的业务规则放入 Foundation（业务规则由调用方拥有）"
   ],
   "prerequisites": [
    "调用方提供明确的根目录（收容边界）"
   ],
   "inputs": [
    "根目录、待解析的相对/绝对路径"
   ],
   "outputs": [
    "受收容的绝对路径或读到的文件内容"
   ],
   "sideEffects": [
    "只读文件系统访问（读取/解析）"
   ],
   "failureSemantics": [
    "SFC2004：path-traversal / symlink-escape / realpath-escape，携带稳定 kind",
    "Windows 盘符/UNC 逃逸同样拒绝"
   ],
   "invariants": [
    "所有解析结果必须落在根目录内"
   ],
   "ownedByCaller": [
    "哪些路径是业务允许的选择规则"
   ],
   "routeElsewhere": [
    "业务文件选择语义：留在调用方",
    "完整树事实与 symlink record：转 filesystem-tree-observation"
   ]
  },
  {
   "id": "foundation.harness.atomic-write",
   "intent": "在已收容路径内以临时文件 + fsync + rename 原子写入普通文件，失败时回滚不留残影",
   "useWhen": [
    "需要更新受收容目录内的普通文本/二进制文件",
    "需要保证写入要么完整可见、要么不可见"
   ],
   "doNotUseWhen": [
    "需要写入未受收容路径（越界由 path-containment 拒绝）"
   ],
   "prerequisites": [
    "目标路径经 path-containment 验证在根目录内"
   ],
   "inputs": [
    "已收容目标路径、文件内容（string 或 Buffer）"
   ],
   "outputs": [
    "写入完成的文件，字节与输入一致"
   ],
   "sideEffects": [
    "在根目录内创建临时文件并最终 rename 覆盖目标"
   ],
   "failureSemantics": [
    "越界路径、非法数据类型抛错并回滚临时文件",
    "二进制内容逐字节保留"
   ],
   "invariants": [
    "rename 前先 fsync，保证崩溃一致性"
   ],
   "ownedByCaller": [
    "写入内容的业务正确性"
   ],
   "routeElsewhere": [
    "内容选择业务规则：留在调用方"
   ]
  },
  {
   "id": "foundation.harness.temporary-workspace",
   "intent": "创建并管理临时工作目录，提供 with 语法的安全生命周期，退出时清理",
   "useWhen": [
    "需要在隔离目录内做构建/中间产物",
    "需要保证异常时临时目录被回收"
   ],
   "doNotUseWhen": [
    "需要持久保存产物（应显式 materialize 到受收容路径）"
   ],
   "prerequisites": [